"Agency","Component","Fiscal Year","No Records","Records Referred at Initial Request Level","Request Withdrawn","Fee-Related Reason","Records Not Reasonably Described","Improper Request for Other Reason","Not Agency Record","Duplicate Request or Appeal","Request in Litigation","Appeal Based Solely on Denial of Request for Expedited Processing","Other*"
"Federal Financial Institutions Examination Council","Agency Overall","2019","0","0","0","0","0","0","0","0","0","0","0"
"Surface Transportation Board","Agency Overall","2019","0","0","0","0","0","0","0","0","0","0","1"
"Commodity Futures Trading Commission","Agency Overall","2019","0","0","0","0","0","0","0","0","0","0","1"
"Social Security Advisory Board","Agency Overall","2019","0","0","0","0","0","0","0","0","0","0","0"
"Federal Retirement Thrift Investment Board","Agency Overall","2019","0","0","0","0","0","0","0","0","0","0","0"
"Office of Management and Budget","Agency Overall","2019","8","0","0","0","0","0","0","0","4","0","0"
"Environmental Protection Agency","Agency Overall","2019","7","1","15","7","0","2","0","10","11","2","48"
"Federal Housing Finance Agency","Agency Overall","2019","1","0","0","0","0","0","0","0","0","0","0"
"Consumer Product Safety Commission","Agency Overall","2019","0","0","0","0","0","0","0","0","0","0","0"
"U.S. Interagency Council on Homelessness","Agency Overall","2019","0","0","0","0","0","0","0","0","0","0","0"
"Office of National Drug Control Policy","Agency Overall","2019","2","0","0","0","0","0","0","0","0","0","0"
"Farm Credit System Insurance Corporation","Agency Overall","2019","0","0","0","0","0","0","0","0","0","0","0"
"National Endowment for the Arts","Agency Overall","2019","0","0","0","0","0","0","0","0","0","0","0"
"National Mediation Board","Agency Overall","2019","0","0","0","0","0","0","0","0","0","0","0"
"U.S. Agency for International Development","Agency Overall","2019","1","0","0","0","0","0","0","0","0","2","2"
"U.S. Election Assistance Commission","Agency Overall","2019","0","0","0","0","0","0","0","0","0","0","0"
"Occupational Safety and Health Review Commission","Agency Overall","2019","0","0","0","0","0","0","0","0","0","0","0"
"United States International Trade Commission","Agency Overall","2019","0","0","0","0","0","0","0","0","0","0","0"
"Social Security Administration","Agency Overall","2019","181","15","5","19","1","3","1","10","0","0","0"
"Department of Labor","Agency Overall","2019","20","0","86","2","1","23","0","28","15","0","38"
"Federal Mine Safety and Health Review Commission","Agency Overall","2019","0","0","0","0","0","0","0","0","0","0","0"
"Department of Defense","Agency Overall","2019","80","13","67","5","11","54","8","28","4","7","88"
"Department of Justice","Agency Overall","2019","693","21","13","22","107","150","13","155","42","66","956"
"Office of the Director of National Intelligence","Agency Overall","2019","0","0","4","0","0","0","0","0","10","0","17"
"Court Services and Offender Supervision Agency","Agency Overall","2019","0","0","0","0","0","0","0","0","0","0","0"
"Department of the Treasury","Agency Overall","2019","20","0","0","0","0","18","0","1","1","1","0"
"U.S. Commission on Civil Rights","Agency Overall","2019","0","0","0","0","0","0","0","0","0","0","0"
"United States Postal Service","Agency Overall","2019","5","0","2","1","0","7","1","4","0","0","3"
"Department of the Interior","Agency Overall","2019","2","0","1","0","0","0","0","0","18","0","32"
"American Battle Monuments Commission","Agency Overall","2019","0","0","0","0","0","0","0","0","0","0","0"
"National Aeronautics and Space Administration","Agency Overall","2019","5","0","0","4","0","1","0","0","0","0","0"
"Office of Special Counsel","Agency Overall","2019","0","0","0","0","0","0","0","0","0","0","0"
"Federal Maritime Commission","Agency Overall","2019","0","0","0","0","0","0","0","0","0","0","0"
"Privacy and Civil Liberties Oversight Board","Agency Overall","2019","1","0","0","0","0","0","0","0","0","0","0"
"Department of Agriculture","Agency Overall","2019","5","1","61","0","2","3","0","4","9","1","76"
"Farm Credit Administration","Agency Overall","2019","0","0","0","0","0","0","0","0","0","0","0"
"U.S. Department of State","Agency Overall","2019","33","0","15","0","0","1","5","0","1","0","8"
"Pension Benefit Guaranty Corporation","Agency Overall","2019","2","0","0","0","0","0","0","0","0","0","4"
"Council on Environmental Quality","Agency Overall","2019","0","0","0","0","0","0","0","1","0","0","0"
"Peace Corps","Agency Overall","2019","0","0","0","0","0","0","0","0","0","0","0"
"General Services Administration","Agency Overall","2019","4","6","3","0","0","0","0","3","0","0","0"
"Merit Systems Protection Board","Agency Overall","2019","2","1","0","0","0","0","0","0","0","0","1"
"Federal Communications Commission","Agency Overall","2019","0","0","7","0","0","2","0","1","0","1","0"
"Tennessee Valley Authority","Agency Overall","2019","2","0","0","0","0","0","0","0","0","0","0"
"Nuclear Regulatory Commission","Agency Overall","2019","8","0","1","14","4","14","2","7","0","2","4"
"Federal Energy Regulatory Commission","Agency Overall","2019","0","0","0","0","0","0","0","0","0","0","0"
"National Archives and Records Administration","Agency Overall","2019","27","0","3","4","1","9","1","1","2","3","2"
"Gulf Coast Ecosystem Restoration Council","Agency Overall","2019","0","0","0","0","0","0","0","0","0","0","0"
"Department of Education","Agency Overall","2019","0","0","8","0","0","0","0","0","2","0","8"
"Department of Energy","Agency Overall","2019","6","0","0","1","0","1","1","0","0","0","3"
"National Commission on Military, National, and Public Service","Agency Overall","2019","0","0","0","0","0","0","0","0","0","2","0"
"Morris K. Udall and Stewart L. Udall Foundation","Agency Overall","2019","0","0","0","0","0","0","0","0","0","0","0"
"United States Access Board","Agency Overall","2019","0","0","0","0","0","0","0","0","0","0","1"
"United States Trade and Development Agency","Agency Overall","2019","0","0","0","0","0","0","0","0","0","0","0"
"Federal Open Market Committee","Agency Overall","2019","0","0","0","0","0","0","0","0","0","0","0"
"Department of Homeland Security","Agency Overall","2019","81","13","45","1","1","499","101","239","16","7","24"
"Federal Mediation and Conciliation Service","Agency Overall","2019","0","0","0","0","0","0","0","0","0","0","0"
"Defense Nuclear Facilities Safety Board","Agency Overall","2019","0","0","0","0","0","0","0","0","0","0","0"
"Department of Commerce","Agency Overall","2019","5","2","8","10","1","4","0","0","3","5","0"
"Inter-American Foundation","Agency Overall","2019","0","0","0","0","0","0","0","0","0","0","0"
"James Madison Memorial Fellowship Foundation","Agency Overall","2019","0","0","0","0","0","0","0","0","0","0","0"
"Presidio Trust","Agency Overall","2019","0","0","0","0","0","0","0","0","0","0","0"
"National Endowment for the Humanities","Agency Overall","2019","0","0","0","0","0","0","0","0","0","0","0"
"Consumer Financial Protection Bureau","Agency Overall","2019","1","0","0","1","0","1","0","0","0","0","0"
"Advisory Council on Historic Preservation","Agency Overall","2019","0","0","0","0","0","0","0","0","0","0","0"
"Federal Reserve System","Agency Overall","2019","1","0","0","0","0","0","0","0","0","0","2"
"Securities and Exchange Commission","Agency Overall","2019","3","0","4","1","0","0","0","0","0","0","9"
"Appraisal Subcommittee","Agency Overall","2019","0","0","0","0","0","0","0","0","0","0","0"
"Office of the United States Trade Representative","Agency Overall","2019","1","0","0","0","0","0","0","0","0","0","0"
"United States International Boundary and Water Commission","Agency Overall","2019","0","0","0","0","0","0","0","0","0","0","0"
"Harry S. Truman Scholarship Foundation","Agency Overall","2019","0","0","0","0","0","0","0","0","0","0","0"
"Federal Trade Commission","Agency Overall","2019","1","0","0","0","0","0","0","1","0","0","0"
"National Science Foundation","Agency Overall","2019","0","0","0","0","0","0","0","0","0","0","0"
"Overseas Private Investment Corporation","Agency Overall","2019","0","0","0","0","0","0","0","0","0","0","0"
"U.S. Nuclear Waste Technical Review Board","Agency Overall","2019","0","0","0","0","0","0","0","0","0","0","0"
"Council of the Inspectors General on Integrity and Efficiency","Agency Overall","2019","0","0","0","0","0","0","0","0","0","0","0"
"United States African Development Foundation","Agency Overall","2019","0","0","0","0","0","0","0","0","0","0","0"
"Federal Labor Relations Authority","Agency Overall","2019","0","0","0","0","0","0","0","0","0","0","0"
"Equal Employment Opportunity Commission","Agency Overall","2019","13","3","27","1","6","44","0","9","0","0","56"
"Office of Personnel Management","Agency Overall","2019","13","2","3","0","1","0","2","0","0","0","0"
"Office of the Special Inspector General for Afghanistan Reconstruction","Agency Overall","2019","0","0","0","0","0","0","0","0","0","0","0"
"Institute of Museum and Library Services","Agency Overall","2019","0","0","0","0","0","0","0","0","0","0","0"
"United States Institute of Peace","Agency Overall","2019","0","0","0","0","0","0","0","0","0","0","0"
"National Indian Gaming Commission","Agency Overall","2019","0","0","0","0","0","0","0","0","0","0","1"
"Federal Election Commission","Agency Overall","2019","0","0","0","0","0","1","0","0","0","0","5"
"Commission of Fine Arts","Agency Overall","2019","0","0","0","0","0","0","0","0","0","0","0"
"National Railroad Passenger Corporation","Agency Overall","2019","0","0","0","0","0","0","0","0","0","0","0"
"Office of Science and Technology Policy","Agency Overall","2019","1","0","1","0","0","0","0","0","0","0","0"
"Denali Commission","Agency Overall","2019","0","0","0","0","0","0","0","0","0","0","0"
"United States Copyright Office","Agency Overall","2019","0","0","0","0","0","0","0","0","0","0","0"
"Committee for Purchase from People Who Are Blind or Severely Disabled","Agency Overall","2019","0","0","0","0","0","0","0","0","0","0","0"
"National Transportation Safety Board","Agency Overall","2019","2","1","4","0","0","10","0","2","0","1","0"
"Selective Service System","Agency Overall","2019","2","0","0","0","0","0","0","0","0","0","0"
"Office of Government Ethics","Agency Overall","2019","0","0","0","0","0","0","0","0","0","0","0"
"Export-Import Bank of the U.S.","Agency Overall","2019","0","0","0","0","0","0","0","0","0","0","0"
"Armed Forces Retirement Home","Agency Overall","2019","0","0","0","0","0","0","0","0","1","0","0"
"Department of Housing and Urban Development","Agency Overall","2019","4","0","6","0","0","0","0","0","0","0","0"
"Administrative Conference of the United States","Agency Overall","2019","0","0","0","0","0","0","0","0","0","0","0"
"Corporation for National and Community Service (operating as AmeriCorps)","Agency Overall","2019","0","0","0","0","0","0","0","0","0","0","1"
"Federal Deposit Insurance Corporation","Agency Overall","2019","0","0","0","0","1","1","0","0","1","0","0"
"Central Intelligence Agency","Agency Overall","2019","1","1","1","0","1","4","1","1","98","0","12"
"Small Business Administration","Agency Overall","2019","0","0","0","0","0","0","0","0","0","0","0"
"Chemical Safety and Hazard Investigation Board","Agency Overall","2019","0","0","0","0","0","0","0","0","0","0","0"
"National Labor Relations Board","Agency Overall","2019","2","0","1","0","0","0","0","0","0","1","1"
"National Credit Union Administration","Agency Overall","2019","0","0","0","0","0","0","0","0","0","0","0"
"Department of Health and Human Services","Agency Overall","2019","9","25","32","0","1","7","0","5","12","0","1"
"Department of Veterans Affairs","Agency Overall","2019","39","0","2","12","0","2","0","3","12","50","46"
"Department of Transportation","Agency Overall","2019","7","0","16","2","0","0","0","1","0","1","0"
"National Council on Disability","Agency Overall","2019","0","0","0","0","0","0","0","0","0","0","0"
"U.S. Railroad Retirement Board","Agency Overall","2019","0","0","0","0","0","0","0","0","0","0","0"
"Office of Navajo and Hopi Indian Relocation","Agency Overall","2019","0","0","0","0","0","0","0","0","0","0","0"
"Millennium Challenge Corporation","Agency Overall","2019","0","0","0","0","0","0","0","0","0","0","0"
"Legal Services Corporation","Agency Overall","2019","0","0","0","1","0","1","0","0","0","0","0"
"U.S. Agency for Global Media","Agency Overall","2019","0","0","1","0","0","0","0","0","0","0","0"
"Neighborhood Reinvestment Corporation","Agency Overall","2019","0","0","0","0","0","0","0","0","0","0","0"
"Marine Mammal Commission","Agency Overall","2019","0","0","0","0","0","0","0","0","0","0","0"
"National Capital Planning Commission","Agency Overall","2019","0","0","0","0","0","0","0","0","0","0","0"
"Postal Regulatory Commission","Agency Overall","2019","0","0","0","0","0","0","0","0","0","0","0"
"All agencies","Agency Overall","2019","1301","105","442","108","139","862","136","514","262","152","1451"