"Agency","Component","Fiscal Year","Number of Full Grants","Number of Partial Grants/Partial Denials","Number of Full Denials Based on Exemptions","No Records","All Records Referred to Another Component or Agency","Request Withdrawn","Fee-Related Reason","Records Not Reasonably Described","Improper FOIA Request for Other Reason","Not Agency Record","Duplicate Request","Other*","Total"
"Office of Science and Technology Policy","Agency Overall","2013","6","16","1","96","0","7","0","4","0","0","0","0","130"
"Department of Justice","Agency Overall","2013","30880","7331","2846","14428","511","756","1439","1966","4511","539","2139","895","68241"
"Court Services and Offender Supervision Agency","Agency Overall","2013","87","598","1","12","0","10","2","0","0","0","5","5","720"
"Chemical Safety and Hazard Investigation Board","Agency Overall","2013","23","3","18","3","0","7","0","0","0","0","3","0","57"
"National Endowment for the Arts","Agency Overall","2013","28","32","4","12","0","3","0","0","0","0","0","3","82"
"Federal Communications Commission","Agency Overall","2013","131","175","11","138","0","55","18","4","3","2","0","37","574"
"United States Trade and Development Agency","Agency Overall","2013","5","0","1","5","0","1","0","0","0","0","0","0","12"
"National Labor Relations Board","Agency Overall","2013","4548","449","221","10","149","170","1","0","0","2","0","0","5550"
"Federal Open Market Committee","Agency Overall","2013","9","3","1","1","3","1","0","0","3","0","0","0","21"
"National Capital Planning Commission","Agency Overall","2013","5","0","0","4","0","0","0","0","0","0","0","0","9"
"Postal Regulatory Commission","Agency Overall","2013","4","1","0","0","18","1","0","0","0","0","0","0","24"
"American Battle Monuments Commission","Agency Overall","2013","1","1","0","1","0","0","0","0","0","0","0","0","3"
"Federal Labor Relations Authority","Agency Overall","2013","32","20","2","38","2","2","0","1","1","0","4","0","102"
"Selective Service System","Agency Overall","2013","18","0","0","0","0","0","0","0","0","0","0","0","18"
"Peace Corps","Agency Overall","2013","88","31","3","8","1","3","0","7","7","0","1","0","149"
"U.S. Commission on Civil Rights","Agency Overall","2013","7","2","0","4","0","0","0","0","1","9","0","0","23"
"Department of Agriculture","Agency Overall","2013","16996","1913","455","915","616","224","84","41","45","60","82","125","21556"
"National Credit Union Administration","Agency Overall","2013","46","47","7","25","1","2","1","1","1","1","2","0","134"
"Federal Mine Safety and Health Review Commission","Agency Overall","2013","166","1","0","5","0","2","0","0","0","0","0","0","174"
"Pension Benefit Guaranty Corporation","Agency Overall","2013","4766","214","180","43","0","43","3","6","37","60","434","0","5786"
"Environmental Protection Agency","Agency Overall","2013","4548","552","69","2772","13","566","111","114","42","34","310","0","9131"
"Consumer Product Safety Commission","Agency Overall","2013","1366","339","33","131","6","16","9","3","0","4","23","16","1946"
"Federal Reserve System","Agency Overall","2013","472","80","31","80","35","53","4","21","29","0","7","42","854"
"Council of the Inspectors General on Integrity and Efficiency","Agency Overall","2013","1","12","1","11","5","1","0","0","0","0","0","0","31"
"Overseas Private Investment Corporation","Agency Overall","2013","2","16","0","8","0","1","1","1","1","0","0","0","30"
"Department of Commerce","Agency Overall","2013","410","332","72","237","24","153","144","75","120","114","66","46","1793"
"U.S. Railroad Retirement Board","Agency Overall","2013","77","27","2","7","6","0","0","0","0","0","0","0","119"
"United States International Trade Commission","Agency Overall","2013","22","3","2","7","0","0","1","0","0","0","0","0","35"
"Securities and Exchange Commission","Agency Overall","2013","2364","424","769","7660","81","99","88","47","55","95","110","375","12167"
"Department of Transportation","Agency Overall","2013","4974","2505","102","1589","39","466","214","17","82","43","99","105","10235"
"Millennium Challenge Corporation","Agency Overall","2013","4","11","5","1","0","0","0","0","0","0","0","0","21"
"Social Security Administration","Agency Overall","2013","38269","791","296","20","2","24","25","25","0","0","3","0","39455"
"Department of Health and Human Services","Agency Overall","2013","40318","2191","5714","9168","3303","1827","451","268","742","278","736","2129","67125"
"Armed Forces Retirement Home","Agency Overall","2013","7","6","3","1","1","0","0","0","0","0","0","0","18"
"Federal Housing Finance Agency","Agency Overall","2013","18","37","28","49","1","10","5","1","1","1","0","0","151"
"Occupational Safety and Health Review Commission","Agency Overall","2013","19","13","0","5","0","10","0","0","0","0","0","0","47"
"Department of the Interior","Agency Overall","2013","2848","1504","161","639","155","166","142","52","72","53","68","503","6363"
"United States Postal Service","Agency Overall","2013","357","535","396","268","207","47","51","27","233","116","34","32","2303"
"Defense Nuclear Facilities Safety Board","Agency Overall","2013","1","2","1","9","0","0","0","1","0","0","0","0","14"
"United States International Boundary and Water Commission","Agency Overall","2013","11","0","1","1","2","0","3","1","0","0","0","0","19"
"Federal Financial Institutions Examination Council","Agency Overall","2013","9","2","0","3","4","1","0","0","1","2","0","0","22"
"Institute of Museum and Library Services","Agency Overall","2013","10","18","0","7","0","0","0","1","0","2","0","3","41"
"Equal Employment Opportunity Commission","Agency Overall","2013","656","13374","2241","556","189","118","32","32","391","15","464","987","19055"
"General Services Administration","Agency Overall","2013","365","390","58","144","26","162","28","16","31","56","42","0","1318"
"Recovery Accountability and Transparency Board","Agency Overall","2013","4","1","2","5","0","2","0","0","0","0","0","0","14"
"Department of Homeland Security","Agency Overall","2013","18840","120300","4378","23942","2121","701","276","660","14378","4879","12647","1210","204332"
"Office of Government Ethics","Agency Overall","2013","16","15","1","9","1","0","0","1","0","0","0","0","43"
"National Archives and Records Administration","Agency Overall","2013","835","598","43","10338","210","55","3","37","94","47","96","897","13253"
"Legal Services Corporation","Agency Overall","2013","13","8","10","5","0","1","0","0","0","0","0","0","37"
"National Mediation Board","Agency Overall","2013","19","0","2","9","2","0","0","0","0","0","0","0","32"
"Office of the Director of National Intelligence","Agency Overall","2013","48","161","28","45","24","0","0","0","0","0","0","68","374"
"Merit Systems Protection Board","Agency Overall","2013","88","51","3","41","3","6","1","1","3","1","4","0","202"
"Office of National Drug Control Policy","Agency Overall","2013","31","0","0","29","0","0","0","0","0","0","0","0","60"
"Department of Housing and Urban Development","Agency Overall","2013","688","346","51","359","460","274","54","29","65","12","62","0","2400"
"National Aeronautics and Space Administration","Agency Overall","2013","209","191","30","99","24","46","68","55","66","35","60","0","883"
"Federal Mediation and Conciliation Service","Agency Overall","2013","38","8","0","24","1","4","1","0","34","1","0","2","113"
"Federal Retirement Thrift Investment Board","Agency Overall","2013","9","7","1","8","0","0","0","0","0","0","0","1","26"
"U.S. Agency for International Development","Agency Overall","2013","60","85","20","39","2","91","7","17","6","7","9","2","345"
"Department of the Treasury","Agency Overall","2013","5336","3626","488","1141","140","359","141","586","2226","283","541","48","14915"
"Federal Maritime Commission","Agency Overall","2013","5","7","1","8","0","2","0","1","0","0","0","0","24"
"Corporation for National and Community Service (operating as AmeriCorps)","Agency Overall","2013","23","28","0","6","0","2","0","0","0","0","0","0","59"
"Department of Labor","Agency Overall","2013","2926","7336","1622","3689","1079","412","547","78","230","201","673","382","19175"
"Federal Deposit Insurance Corporation","Agency Overall","2013","201","130","53","85","1","48","32","55","36","85","6","12","744"
"National Endowment for the Humanities","Agency Overall","2013","14","12","0","8","0","0","0","0","0","0","0","0","34"
"Nuclear Regulatory Commission","Agency Overall","2013","93","97","21","40","3","47","18","2","1","3","5","40","370"
"National Transportation Safety Board","Agency Overall","2013","36","48","110","40","1","16","1","0","37","8","14","0","311"
"Federal Energy Regulatory Commission","Agency Overall","2013","14","30","27","17","0","10","0","0","0","0","0","1","99"
"Federal Trade Commission","Agency Overall","2013","489","571","33","240","2","50","14","12","6","1","15","10","1443"
"Office of Special Counsel","Agency Overall","2013","12","34","15","15","0","2","0","0","11","40","0","0","129"
"Committee for Purchase from People Who Are Blind or Severely Disabled","Agency Overall","2013","1","2","0","1","0","0","0","0","0","0","0","0","4"
"Consumer Financial Protection Bureau","Agency Overall","2013","49","78","17","28","4","15","5","3","2","8","0","0","209"
"Farm Credit Administration","Agency Overall","2013","18","3","1","5","0","2","0","0","0","0","0","0","29"
"Small Business Administration","Agency Overall","2013","4329","180","49","163","28","41","12","28","44","28","12","32","4946"
"Office of Personnel Management","Agency Overall","2013","7618","4459","27","30","1","20","5","2","9","7","1","5","12184"
"Farm Credit System Insurance Corporation","Agency Overall","2013","5","0","0","3","0","0","0","0","0","0","0","0","8"
"National Science Foundation","Agency Overall","2013","28","196","8","38","4","28","0","0","1","0","1","1","305"
"Department of Defense","Agency Overall","2013","24368","15396","5183","6063","6365","2080","814","642","1206","917","1331","3314","67679"
"United States African Development Foundation","Agency Overall","2013","0","0","0","4","0","0","0","0","0","0","0","0","4"
"Surface Transportation Board","Agency Overall","2013","21","3","1","5","1","1","0","0","0","0","0","0","32"
"Central Intelligence Agency","Agency Overall","2013","462","1052","1951","127","119","10","29","174","236","0","0","465","4625"
"U.S. Agency for Global Media","Agency Overall","2013","13","13","3","10","0","0","1","0","5","0","0","0","45"
"Inter-American Foundation","Agency Overall","2013","7","1","1","2","0","0","0","0","0","0","0","0","11"
"United States Copyright Office","Agency Overall","2013","12","3","2","7","9","0","1","0","0","2","0","0","36"
"U.S. Department of State","Agency Overall","2013","3468","4312","7445","658","313","368","28","2091","1516","730","130","38","21097"
"Department of Veterans Affairs","Agency Overall","2013","10468","7900","5791","1175","38","249","148","118","284","36","154","15","26376"
"Office of Management and Budget","Agency Overall","2013","49","29","12","91","0","0","0","0","0","0","0","0","181"
"National Indian Gaming Commission","Agency Overall","2013","8","18","3","6","0","7","1","0","1","0","0","1","45"
"Office of Navajo and Hopi Indian Relocation","Agency Overall","2013","166","82","0","0","0","0","0","0","0","0","0","0","248"
"Council on Environmental Quality","Agency Overall","2013","12","8","0","10","0","4","0","0","0","0","0","0","34"
"Office of the United States Trade Representative","Agency Overall","2013","39","8","1","22","2","4","0","6","0","0","0","0","82"
"Tennessee Valley Authority","Agency Overall","2013","49","65","8","20","0","7","12","0","0","0","0","0","161"
"Commodity Futures Trading Commission","Agency Overall","2013","40","58","8","25","0","12","1","1","1","2","0","0","148"
"National Railroad Passenger Corporation","Agency Overall","2013","52","52","16","11","0","11","18","5","7","7","8","0","187"
"Export-Import Bank of the U.S.","Agency Overall","2013","16","20","4","4","0","3","4","0","0","0","0","0","51"
"Department of Energy","Agency Overall","2013","766","409","25","308","258","148","32","18","21","40","21","0","2046"
"Administrative Conference of the United States","Agency Overall","2013","2","1","0","16","0","0","0","0","0","0","0","0","19"
"Department of Education","Agency Overall","2013","573","1222","145","185","58","138","9","56","6","6","23","0","2421"
"Office of the Special Inspector General for Afghanistan Reconstruction","Agency Overall","2013","0","12","4","7","4","3","0","0","0","0","0","0","30"
"Federal Election Commission","Agency Overall","2013","22","22","0","23","1","2","0","0","0","2","1","0","73"
"All agencies","Agency Overall","2013","237682","203295","41380","88409","16679","10288","5140","7410","26941","8874","20446","11847","678391"