"Agency","Component","Fiscal Year","Simple - Median Number of Days","Simple - Average Number of Days","Simple - Lowest Number of Days","Simple - Highest Number of Days","Complex - Median Number of Days","Complex - Average Number of Days","Complex - Lowest Number of Days","Complex - Highest Number of Days","Expedited Processing - Median Number of Days","Expedited Processing - Average Number of Days","Expedited Processing - Lowest Number of Days","Expedited Processing - Highest Number of Days"
"Securities and Exchange Commission","Agency Overall","2017","7","12.5","<1","445","786","733","309","1016","14.5","12.75","4","18"
"Institute of Museum and Library Services","Agency Overall","2017","18","20.1","4","43","47","56.71","27","98","9","9","9","9"
"Office of National Drug Control Policy","Agency Overall","2017","8","18","1","194","N/A","N/A","N/A","N/A","N/A","N/A","N/A","N/A"
"Federal Mediation and Conciliation Service","Agency Overall","2017","15","32","<1","214","157","145","101","157","6","6","4","9"
"Central Intelligence Agency","Agency Overall","2017","13","28.91","1","695","201.5","319.36","4","2713","12","12","12","12"
"Office of the Special Inspector General for Afghanistan Reconstruction","Agency Overall","2017","20","23","1","88","113","115","6","267","17","17","17","17"
"Committee for Purchase from People Who Are Blind or Severely Disabled","Agency Overall","2017","9","8.5","3","14","49","49","38","60","N/A","N/A","N/A","N/A"
"National Aeronautics and Space Administration","Agency Overall","2017","3","5.73","<1","40","21","27.12","<1","217","16","16","10","22"
"Legal Services Corporation","Agency Overall","2017","13.75","13.08","1","43","N/A","N/A","N/A","N/A","12.5","13.25","9","19"
"Selective Service System","Agency Overall","2017","4","4","1","17","N/A","N/A","N/A","N/A","N/A","N/A","N/A","N/A"
"U.S. Commission on Civil Rights","Agency Overall","2017","6","8","1","29","11","15","1","41","N/A","N/A","N/A","N/A"
"National Capital Planning Commission","Agency Overall","2017","3.5","3.6","<1","8","N/A","N/A","N/A","N/A","N/A","N/A","N/A","N/A"
"General Services Administration","Agency Overall","2017","11","10.99","<1","38","37","55.85","21","322","22","34.68","1","120"
"Inter-American Foundation","Agency Overall","2017","7","7","1","14","N/A","N/A","N/A","N/A","N/A","N/A","N/A","N/A"
"National Science Foundation","Agency Overall","2017","10","64","1","1112","92","290","1","1449","16","16","6","27"
"Defense Nuclear Facilities Safety Board","Agency Overall","2017","8","10.58","<1","24","N/A","N/A","N/A","N/A","1.5","1.5","<1","2"
"Department of Education","Agency Overall","2017","11","14.18","<1","492","58","124","<1","1764","73","73","17","129"
"Millennium Challenge Corporation","Agency Overall","2017","12","11.5","1","33","N/A","N/A","N/A","N/A","N/A","N/A","N/A","N/A"
"Council of the Inspectors General on Integrity and Efficiency","Agency Overall","2017","N/A","N/A","N/A","N/A","32","48.6","5","181","N/A","N/A","N/A","N/A"
"U.S. Department of State","Agency Overall","2017","393","390.17","1","2076","478","650.41","3","2822","500","416.1","11","1228"
"Department of the Treasury","Agency Overall","2017","6","18","<1","1508","14","36","<1","2286","30","52","<1","222"
"Consumer Financial Protection Bureau","Agency Overall","2017","8","10.97","<1","78","36","38.55","23","86","N/A","N/A","N/A","N/A"
"Federal Mine Safety and Health Review Commission","Agency Overall","2017","1","3","<1","25","6","12.4","1","43","1","1","<1","1"
"Office of Management and Budget","Agency Overall","2017","23","87","1","888","N/A","N/A","N/A","N/A","N/A","N/A","N/A","N/A"
"Department of Labor","Agency Overall","2017","7","27.9","1","2535","10","31.3","1","2523","9","20.8","1","616"
"Pension Benefit Guaranty Corporation","Agency Overall","2017","5","5.98","<1","26","15","18.35","<1","249","N/A","N/A","N/A","N/A"
"National Mediation Board","Agency Overall","2017","5.5","6.9","<1","13","N/A","N/A","N/A","N/A","3","3","3","3"
"Federal Open Market Committee","Agency Overall","2017","4","8.3","<1","20","137","121.8","81","144","N/A","N/A","N/A","N/A"
"Federal Deposit Insurance Corporation","Agency Overall","2017","7","8.93","<1","69","27","30.39","3","139","18","20.33","3","65"
"National Archives and Records Administration","Agency Overall","2017","<1","8.65","<1","2917","563.5","882.9","<1","5820","1","9.8","<1","44"
"Farm Credit System Insurance Corporation","Agency Overall","2017","14","12","1","20","N/A","N/A","N/A","N/A","3","3","3","3"
"Corporation for National and Community Service (operating as AmeriCorps)","Agency Overall","2017","3","9","<1","57","36","34","4","49","2","11","1","18"
"Federal Trade Commission","Agency Overall","2017","4","5.7","<1","88","17","33","<1","402","19","18","8","27"
"Office of Personnel Management","Agency Overall","2017","1","3.1","1","848","20","30.9","1","810","N/A","N/A","N/A","N/A"
"National Endowment for the Arts","Agency Overall","2017","12","12","1","22","20","24","18","31","N/A","N/A","N/A","N/A"
"United States Postal Service","Agency Overall","2017","4","9.12","1","539","23","89.58","1","1182","6","7","1","16"
"Morris K. Udall and Stewart L. Udall Foundation","Agency Overall","2017","10","10","1","20","N/A","N/A","N/A","N/A","N/A","N/A","N/A","N/A"
"U.S. Nuclear Waste Technical Review Board","Agency Overall","2017","1","1","1","1","N/A","N/A","N/A","N/A","N/A","N/A","N/A","N/A"
"United States African Development Foundation","Agency Overall","2017","18","13.7","1","20","24.5","24.5","19","30","N/A","N/A","N/A","N/A"
"U.S. Agency for International Development","Agency Overall","2017","10","10.78","<1","37","150.5","291.48","<1","1314","534","590.25","381","947"
"National Credit Union Administration","Agency Overall","2017","2","4.24","<1","20","27","32.94","2","131","10.5","10.5","5","16"
"Federal Retirement Thrift Investment Board","Agency Overall","2017","37","51","6","220","N/A","N/A","N/A","N/A","N/A","N/A","N/A","N/A"
"Gulf Coast Ecosystem Restoration Council","Agency Overall","2017","8","6","1","9","N/A","N/A","N/A","N/A","N/A","N/A","N/A","N/A"
"Small Business Administration","Agency Overall","2017","5","14.3","<1","335","9","21.6","1","70","1","1.71","<1","4"
"Neighborhood Reinvestment Corporation","Agency Overall","2017","16.5","16.5","5","28","65","65","65","65","16","16","16","16"
"Equal Employment Opportunity Commission","Agency Overall","2017","18","32.09","<1","414","38","46.97","<1","170","26","36.75","3","92"
"Department of Transportation","Agency Overall","2017","16","62.52","<1","1395","47","161.3","<1","1131","13","137.6","1","997"
"United States Trade and Development Agency","Agency Overall","2017","N/A","N/A","N/A","N/A","60","173","5","875","N/A","N/A","N/A","N/A"
"Federal Communications Commission","Agency Overall","2017","17","18.26","<1","268","47","67.79","4","283","14","22.54","<1","150"
"Tennessee Valley Authority","Agency Overall","2017","7","7.54","1","20","36.5","62.5","21","322","18","32","6","91"
"U.S. Agency for Global Media","Agency Overall","2017","N/A","N/A","N/A","N/A","58","70.5","4","277","5","5","5","5"
"Environmental Protection Agency","Agency Overall","2017","14","18.15","<1","510","57","173.35","<1","2217","22","86.97","<1","801"
"Nuclear Regulatory Commission","Agency Overall","2017","8","16.57","<1","179","34.5","63.23","<1","245","297","297","297","297"
"Administrative Conference of the United States","Agency Overall","2017","1","1.1","<1","2","21","21","21","21","N/A","N/A","N/A","N/A"
"Department of the Interior","Agency Overall","2017","3","8","<1","384","19","45","<1","1339","37","45","<1","428"
"U.S. Election Assistance Commission","Agency Overall","2017","40.5","46.13","1","112","N/A","N/A","N/A","N/A","N/A","N/A","N/A","N/A"
"Armed Forces Retirement Home","Agency Overall","2017","15","5","1","15","N/A","N/A","N/A","N/A","N/A","N/A","N/A","N/A"
"Appraisal Subcommittee","Agency Overall","2017","5","5","2","8","N/A","N/A","N/A","N/A","N/A","N/A","N/A","N/A"
"Privacy and Civil Liberties Oversight Board","Agency Overall","2017","13.84","12","2","71","N/A","N/A","N/A","N/A","N/A","N/A","N/A","N/A"
"Office of Special Counsel","Agency Overall","2017","33","76.93","<1","663","472.5","566.48","3","1476","307","326.92","<1","1021"
"United States Copyright Office","Agency Overall","2017","17","18","2","48","N/A","N/A","N/A","N/A","N/A","N/A","N/A","N/A"
"National Labor Relations Board","Agency Overall","2017","21","34.88","<1","439","N/A","N/A","0","0","2.5","8.03","<1","53"
"Department of Health and Human Services","Agency Overall","2017","11","18.95","<1","1064","36","99.93","<1","1674","42","69.53","<1","1214"
"United States Institute of Peace","Agency Overall","2017","13","13","13","13","N/A","N/A","N/A","N/A","N/A","N/A","N/A","N/A"
"Department of Housing and Urban Development","Agency Overall","2017","17","27.82","<1","669","28","57.88","<1","863","5","12.39","<1","63"
"James Madison Memorial Fellowship Foundation","Agency Overall","2017","2","2","2","2","N/A","N/A","N/A","N/A","N/A","N/A","N/A","N/A"
"Commodity Futures Trading Commission","Agency Overall","2017","17","24.55","<1","658","292.5","322.08","20","919","19","27","2","60"
"Harry S. Truman Scholarship Foundation","Agency Overall","2017","18","15","1","26","N/A","N/A","N/A","N/A","N/A","N/A","N/A","N/A"
"Overseas Private Investment Corporation","Agency Overall","2017","6","12.5","<1","79","64","118.5","1","519","<1","<1","<1","<1"
"United States International Trade Commission","Agency Overall","2017","14","14","1","27","27","27","27","27","N/A","N/A","N/A","N/A"
"National Endowment for the Humanities","Agency Overall","2017","14","12.37","1","21","20","34.38","15","113","N/A","N/A","N/A","N/A"
"U.S. Interagency Council on Homelessness","Agency Overall","2017","17","15","1","25","N/A","N/A","N/A","N/A","N/A","N/A","N/A","N/A"
"Chemical Safety and Hazard Investigation Board","Agency Overall","2017","13","18","<1","72","87","124","12","374","N/A","N/A","N/A","N/A"
"Merit Systems Protection Board","Agency Overall","2017","13","79.3","<1","619","98","231.7","9","705","4","4","4","4"
"Department of Defense","Agency Overall","2017","9.84","16.34","<1","1486","104.81","156.53","<1","3678","16.72","25.75","<1","1169"
"Federal Energy Regulatory Commission","Agency Overall","2017","30","34","1","198","30","35","12","120","N/A","N/A","N/A","N/A"
"Department of Agriculture","Agency Overall","2017","1","11.09","<1","1311","25","88.22","<1","1894","19","26.76","1","149"
"Social Security Administration","Agency Overall","2017","7","12.05","1","120","102","116","5","632","40","40","26","54"
"Federal Reserve System","Agency Overall","2017","4","8","1","140","44","76","1","461","38","38","38","38"
"Commission of Fine Arts","Agency Overall","2017","8","8","6","10","30","30","30","30","1","1","1","1"
"Export-Import Bank of the U.S.","Agency Overall","2017","6","10.4","<1","96","142","178.76","7","756","23","23","12","34"
"Council on Environmental Quality","Agency Overall","2017","18","64","<1","818","131","204","2","1005","70","70","70","70"
"American Battle Monuments Commission","Agency Overall","2017","7","7","7","7","20","20.65","4","46","6","6","6","6"
"Surface Transportation Board","Agency Overall","2017","7","7.95","1","20","N/A","N/A","N/A","N/A","7","7","7","7"
"Department of Veterans Affairs","Agency Overall","2017","11","33","<1","1265","34","73","<1","920","15","62","<1","347"
"Federal Financial Institutions Examination Council","Agency Overall","2017","5.5","7.4","1","17","32","32","32","32","N/A","N/A","N/A","N/A"
"Office of the Director of National Intelligence","Agency Overall","2017","7","24.33","<1","732","90","236.25","5","1279","407","565","260","1028"
"Court Services and Offender Supervision Agency","Agency Overall","2017","20","31.92","<1","146","43","68.83","1","197","N/A","N/A","N/A","N/A"
"Occupational Safety and Health Review Commission","Agency Overall","2017","5","6.2","1","20","N/A","N/A","N/A","N/A","N/A","N/A","N/A","N/A"
"United States Access Board","Agency Overall","2017","3","5.6","<1","19","N/A","N/A","N/A","N/A","N/A","N/A","N/A","N/A"
"Federal Election Commission","Agency Overall","2017","12","14.5","3","79","50.5","97.2","11","448","20","20","20","20"
"U.S. Railroad Retirement Board","Agency Overall","2017","970","337.75","2","1069","N/A","N/A","N/A","N/A","N/A","N/A","N/A","N/A"
"Department of Commerce","Agency Overall","2017","10","13.2","<1","123","49","130.6","<1","1340","11","75.33","<1","882"
"United States International Boundary and Water Commission","Agency Overall","2017","10.5","22","1","80","N/A","N/A","N/A","N/A","N/A","N/A","N/A","N/A"
"Department of Justice","Agency Overall","2017","20","27.87","<1","1124","83","167.24","<1","1625","60","129.47","1","1481"
"National Indian Gaming Commission","Agency Overall","2017","85","126.3","1","504","267","289.47","60","663","N/A","N/A","N/A","N/A"
"Office of the United States Trade Representative","Agency Overall","2017","13","16","1","86","99","157","21","523","3","5","1","12"
"National Council on Disability","Agency Overall","2017","N/A","N/A","N/A","N/A","N/A","N/A","N/A","N/A","N/A","N/A","N/A","N/A"
"Presidio Trust","Agency Overall","2017","7","8","<1","17","N/A","N/A","N/A","N/A","N/A","N/A","N/A","N/A"
"Department of Homeland Security","Agency Overall","2017","28.77","39.11","<1","1302","111.66","93.51","<1","1586","25.67","48.3","<1","537"
"Federal Housing Finance Agency","Agency Overall","2017","6","10.62","<1","154","39","128.61","<1","984","23","21","9","31"
"Consumer Product Safety Commission","Agency Overall","2017","7","25","1","404","38","67","1","851","N/A","N/A","N/A","N/A"
"Denali Commission","Agency Overall","2017","N/A","N/A","N/A","N/A","N/A","N/A","N/A","N/A","N/A","N/A","N/A","N/A"
"Federal Maritime Commission","Agency Overall","2017","5.5","6","4","9","24","30.3","4","77","10","10","10","10"
"National Railroad Passenger Corporation","Agency Overall","2017","10.5","51.36","1","471","32","129.53","1","922","422","380.78","49","542"
"Social Security Advisory Board","Agency Overall","2017","5","5","5","5","N/A","N/A","N/A","N/A","N/A","N/A","N/A","N/A"
"Marine Mammal Commission","Agency Overall","2017","14","10.75","4","15","N/A","N/A","N/A","N/A","N/A","N/A","N/A","N/A"
"Department of Energy","Agency Overall","2017","21","48.23","<1","752","52","164.61","<1","2296","N/A","N/A","N/A","N/A"
"Farm Credit Administration","Agency Overall","2017","7","9.26","<1","22","N/A","N/A","N/A","N/A","3","3","3","3"
"Postal Regulatory Commission","Agency Overall","2017","10","11","2","29","N/A","N/A","N/A","N/A","8","8","8","8"
"Office of Science and Technology Policy","Agency Overall","2017","6.5","24.063","1","183","245","244","5","541","172.5","125.3","10","182"
"Office of Government Ethics","Agency Overall","2017","18","18.4","1","128","N/A","N/A","N/A","N/A","14","17.3","1","67"
"Office of Navajo and Hopi Indian Relocation","Agency Overall","2017","1","1.66","1","13","N/A","N/A","N/A","N/A","N/A","N/A","N/A","N/A"
"National Transportation Safety Board","Agency Overall","2017","79","252.53","<1","1017","508.5","448.63","1","1230","2","2","2","2"
"Peace Corps","Agency Overall","2017","24","65","<1","767","196","300","45","973","N/A","N/A","N/A","N/A"
"Federal Labor Relations Authority","Agency Overall","2017","5.5","7.08","<1","22","N/A","N/A","N/A","N/A","4","5.33","1","16"